{
  "apiVersion": "modos.pleiades/v1alpha1",
  "authority": {
    "canonicalMutation": "forbidden",
    "ceiling": "none",
    "promotionTransactionRequired": true,
    "selfPromotionAllowed": false
  },
  "evidenceRefs": ["evidence:local-fixture"],
  "expectedSemanticEffects": [
    "Mind participates in the shared cognitive workspace without granting the proposal authority."
  ],
  "kind": "ChangeProposal",
  "mindId": "mind:pleiades",
  "objectFamily": "Mind",
  "operations": [
    {
      "objectId": "mind:pleiades",
      "op": "link",
      "relationType": "participatesIn",
      "targetRef": "workspace:pleiades"
    }
  ],
  "proposalId": "proposal:link-workspace-0001",
  "rationale": "Bind the persistent Pleiades mind to the shared typed cognitive workspace.",
  "rollbackPlan": "Remove the exact participatesIn relation and restore the source snapshot digest.",
  "sourceSnapshotDigest": "sha256:6cdb735ccdd132b7c86a7f60df6f953138f3555bfc362708947f7a8f5832ea51",
  "targetSchemaVersion": "v1alpha1"
}
