{
  "apiVersion": "modos.pleiades/v1alpha1",
  "authority": {
    "canonicalMutation": "forbidden",
    "ceiling": "none",
    "promotionTransactionRequired": true,
    "selfPromotionAllowed": false
  },
  "evidenceRefs": [
    "evidence:local-fixture"
  ],
  "expectedSemanticEffects": [
    "The compiler must refuse a dangling reference."
  ],
  "kind": "ChangeProposal",
  "mindId": "mind:pleiades",
  "objectFamily": "CognitiveWorkspace",
  "operations": [
    {
      "objectId": "workspace:pleiades",
      "op": "delete"
    }
  ],
  "proposalId": "proposal:delete-workspace-0001",
  "rationale": "Exercise closure refusal when deleting an object still referenced by a relation.",
  "rollbackPlan": "Discard the proposal without changing the source snapshot.",
  "sourceSnapshotDigest": "sha256:6cdb735ccdd132b7c86a7f60df6f953138f3555bfc362708947f7a8f5832ea51",
  "targetSchemaVersion": "v1alpha1"
}
