{
  "apiVersion": "modos.pleiades/v1alpha1",
  "authority": {
    "canonicalMutation": "forbidden",
    "ceiling": "none",
    "promotionTransactionRequired": true,
    "selfPromotionAllowed": false
  },
  "evidenceRefs": ["evidence:local-fixture"],
  "expectedSemanticEffects": [
    "Mind continuity requirements become explicit while authority remains unchanged."
  ],
  "kind": "ChangeProposal",
  "mindId": "mind:pleiades",
  "objectFamily": "Mind",
  "operations": [
    {
      "objectId": "mind:pleiades",
      "op": "update",
      "payload": {
        "apiVersion": "modos.pleiades/v1alpha1",
        "kind": "Mind",
        "metadata": {
          "createdAt": "2026-07-20T00:00:00Z",
          "generation": 2,
          "id": "mind:pleiades",
          "name": "Pleiades persistent mind"
        },
        "partitionPolicy": {
          "conflictVisibility": "steward",
          "globalAuthorityRequired": true,
          "merge": "steward-review",
          "read": "allow-cached",
          "write": "provisional"
        },
        "provenance": {
          "digest": "sha256:4444444444444444444444444444444444444444444444444444444444444444",
          "lineage": [],
          "source": "fixture:seed",
          "trust": "verified",
          "visibility": "public"
        },
        "spec": {
          "continuityLedgerRequired": true,
          "dissentPreserved": true,
          "modelReplaceability": true,
          "persistentOrganization": true
        }
      }
    }
  ],
  "proposalId": "proposal:update-mind-0001",
  "rationale": "Advance the Mind object by one generation to require explicit continuity evidence.",
  "rollbackPlan": "Restore the generation-one Mind object and exact source snapshot digest.",
  "sourceSnapshotDigest": "sha256:6cdb735ccdd132b7c86a7f60df6f953138f3555bfc362708947f7a8f5832ea51",
  "targetSchemaVersion": "v1alpha1"
}
